{"$schema":"https://json-schema.org/draft/2020-12/schema","$id":"https://agentropolis.local/schemas/sovereignty/providers.schema.json","type":"array","items":{"type":"object","additionalProperties":false,"required":["id","name","type","jurisdictionId","hardwareId","endpoint","approvedForRestrictedData"],"properties":{"id":{"type":"string","pattern":"^[a-z0-9][a-z0-9-]*$"},"name":{"type":"string","minLength":1},"type":{"enum":["local","private","cloud"]},"jurisdictionId":{"type":"string"},"hardwareId":{"type":"string"},"endpoint":{"type":"string","format":"uri"},"approvedForRestrictedData":{"type":"boolean"}}}}
