[{"id":"local-provider","name":"Local Provider","type":"local","jurisdictionId":"us","hardwareId":"local-gpu","endpoint":"http://127.0.0.1:9101/infer","approvedForRestrictedData":true},{"id":"private-provider","name":"Private Provider","type":"private","jurisdictionId":"eu","hardwareId":"private-cluster","endpoint":"http://127.0.0.1:9102/infer","approvedForRestrictedData":true},{"id":"cloud-provider","name":"Cloud Provider","type":"cloud","jurisdictionId":"us","hardwareId":"cloud-gpu","endpoint":"https://cloud.example.com/infer","approvedForRestrictedData":false}]
